acousticness,danceability,duration_ms,energy,id,instrumentalness,key,liveness,loudness,mode,popularity,release_date,speechiness,spotify_album,spotify_artist,spotify_song,tempo,time_signature,type,uri,valence,lyrics
0.503,0.6509999999999999,197040.0,0.465,77iRifbhkJGvGBBRNykUwN,0.0455,4.0,0.495,-7.537999999999999,1.0,58.0,2016-09-09,0.0328,The End Of Comedy,Drugdealer,Suddenly,107.75,4.0,audio_features,spotify:track:77iRifbhkJGvGBBRNykUwN,0.585,"Suddenly
My mind is open
And I know
You won't be sitting with me
Tempted by the morning sun
And now I feel
Like I'm home again
I'm home again
I'm home again
Suddenly my
Eyes are open
And I see
You won't be there
Tempted by the midnight hour
And now I feel
I'm alone again
I'm home again
I'm home"
0.6459999999999999,0.0903,353732.0,0.36200000000000004,31LKL7XfxR1PTm6Or9KTKv,0.402,7.0,0.106,-8.929,0.0,55.0,2019-04-05,0.0337,Titanic Rising,Weyes Blood,Movies,74.729,4.0,audio_features,spotify:track:31LKL7XfxR1PTm6Or9KTKv,0.0964,"This is how it feels to be in love
This is life from above
There's no books anymore
I'm bound to that summer
Big box office hit
Making love to a counterfeit
Why did so many
Get a rise out of me?
I love the movies
Some people feel what some people don't
Some people watch until they explode
The meaning of life doesn't seem to shine like that screen
Put me in a movie and everyone will know me
You'll be the star you know you are
The movies I watched when I was a kid
The hopes and the dreams
Don't give credit to the real things
I love the movies
I know the meaning
I know the story
I know the glory
I love movies
I wanna be in my own movie
I wanna be
I wanna be the star of mine
Of my own, my own
My own
I wanna be the star
I wanna be
I wanna be the star of mine
Of my own, my own
My own"
0.114,0.679,183525.0,0.71,6IY3cC281mz9q0bViUEldz,0.00322,8.0,0.255,-5.0089999999999995,0.0,60.0,2017-07-28,0.0321,Content,Joywave,It's A Trip!,97.99,4.0,audio_features,spotify:track:6IY3cC281mz9q0bViUEldz,0.685,"Creepy little sneaky little foreign places
Terrifying territories, I can't take it
It's a great big atlas, yeah
I'm feeling dumb
When you've gotten what you want
Maybe I should start over
There's nothing left to want
Up and at 'em again
You don't know what you want
Yeah, I'm thinking it over
Just tell me what to want
Floating little second hands laugh like jokers
Keepin' me from thinking straight
I've lost composure
When you've gotten what you want
Maybe I should start over
There's nothing left to want
Up and at 'em again
You don't know what you want
Yeah, I'm thinking it over
Just tell me what I...
When you've gotten what you want
Maybe I should start over
There's nothing left to want
Up and at 'em again
You don't know what you want
Yeah, I'm thinking it over
Just tell me what to want
This is a trip
This is a trip
When you've gotten what you want
There's nothing left to want
You don't know what you want
Yeah, I'm thinking it over
Just tell me what I...
When you've gotten what you want
Maybe I should start over
There's nothing left to want
Up and at 'em again
You don't know what you want
Yeah, I'm thinking it over
Just tell me what to want"
0.856,0.633,325155.0,0.565,1iJdIZU5Ffgixa92wrcZZC,0.00542,11.0,0.381,-11.125,1.0,49.0,2017-05-05,0.0614,Meeting Of The Waters,Animal Collective,Man Of Oil,109.95100000000001,4.0,audio_features,spotify:track:1iJdIZU5Ffgixa92wrcZZC,0.77,"Peaceful songs
Will get along
If we leave 'em together in the armory
On my knees
My head on your queasy stomach
Can not keep my chin up
I woke to sweats in the night
Strange sensation to feel alive
I find it so hard to tell you
I'm afraid to forget the smell of you
Wizard with a wand
Competing with the lightning
Coward and also a king
And a man of oil
Floating logs on the dark stream
Move me unlike apologies I'm texting
Broken limbs filled with smooth snakeskin
On a Ferris wheel far from cash, love
You've got to have the tough guts
So you're hung like a human
And watch the young nuts grow
I find it so hard to hear you
Say you think that I never hear you
Wizard with a wand
Competing with the lightning
Coward and also a king
And a man of oil
I woke to sweats in the night
Strange sensation to be alive
I find it so hard to tell you
I'm afraid to forget the smell of you
Wizard with a wand
Competing with the lightning
Coward and also a king
And a man of oil"
0.354,0.7909999999999999,168253.0,0.506,77jyU4a7UBdbpZvaYcWYtX,2.47e-05,11.0,0.109,-4.702,0.0,2.0,2016-08-18,0.368,Help,Weaves,Help,77.74,4.0,audio_features,spotify:track:77jyU4a7UBdbpZvaYcWYtX,0.447,"I'll be drowning in the waves
But I will wait for you
You're driving me insane
But I will stay for you
Six feet in a grave
I would lie for you
Forever and a day
I'm yours
I lie awake
While the clock tick tocks away
But gives no relief
Days turn to weeks
You're still gone, I'm alone, and wondering when the end will be
It never comes
Another sun
Will set into the sea
But I need you to know
That I'll be drowning in the waves
But I will wait for you
You're driving me insane
But I will stay for you
Six feet in a grave
I would lie for you
Forever and a day
I'm yours
I'm yours
Today's the day
When the silence breaks
And you're coming back to me
Oh sweet relief
Finally I can stop wondering when the end will be
You gave me love
I came undone
I'm struggling
But I need you to know
That I'll be drowning in the waves
But I will wait for you
You're driving me insane
But I will stay for you
Six feet in a grave
I would lie for you
Forever and a day
I'm yours
I'm yours
I'll be drowning in the waves
But I will wait for you
You're driving me insane
But I will stay for you
Six feet in a grave
I would lie for you
Forever and a day
I'm yours
I'm yours"
0.0801,0.706,229120.0,0.6990000000000001,5Xan7abEunERTQRmECYSKq,0.166,8.0,0.17,-3.944,1.0,1.0,2015-12-07,0.171,Drag Me Down,Weaves,Drag Me Down,144.857,4.0,audio_features,spotify:track:5Xan7abEunERTQRmECYSKq,0.489,"Where would I be if I don’t have you?
You are the hope that I hold onto
You’re the rope when I’m lost in the ocean
Where would I be if you cut me loose?
When I feel I’m close to the shore
Waves pull me back again
Back to the open and wide
When I feel the weight drag me down
Waves pull me back again
Back to the open and wide
Only you can turn the tide
Yeah, you can turn the tide
You followed a flare 'til you found me here
Cold and alone in a sea of fear
Brought me home you’re the sweet salvation
Where would I be if you’d disappear?
When I feel I’m close to the shore
Waves pull me back again
Back to the open and wide
When I feel the weight drag me down
Waves pull me back again
Back to the open and wide
Only you can turn the tide
You can turn the tide
You can never love, you can never ever love alone
You can never love, you can never ever love on your own
Where would I be if I don’t have you?
You are the hope that I hold onto
When I feel I’m close to the shore
Waves pull me back again
Back to the open and wide
When I feel the weight drag me down
Waves pull me back again
Back to the open and wide
Only you can turn the tide
You can turn the tide
Only you can turn the tide
Yeah, you can turn the tide"
0.14800000000000002,0.485,313000.0,0.659,7fGxqyHFmWrs3GhpwSht4H,0.00295,5.0,0.171,-5.83,1.0,33.0,2017-07-13,0.0293,EGO,RAC,Fever,85.99600000000001,4.0,audio_features,spotify:track:7fGxqyHFmWrs3GhpwSht4H,0.121,"The heat hits and fades
After the fall
Smoke in the air from where we let go it all
These undefined ways set the pace off in a blaze
So good to feel the same way
Fever
Can you feel the fever?
Feel the rush that overtakes you
When it hits you we're on fire
Fever
We hear the sounds of the dawn to come
Till then we're reckless speeding into the unknown
Let me hear the town
Tempo of your heartbeat multiplied
Only the rhythm in between us counts tonight
Fever
Can you feel the fever?
Feel the rush that overtakes you
When it hits you we're on fire
Fever
Let me hear the sound
Let me draw 'em down
Let me feel the reckless speeding into the unknown
Let me feel the fire
Hearing your heartbeat multiplied
Only the rhythm in between us counts tonight
It's all this for now
There's no better way to be loved
That's the sound
Can we live inside love?
I wanna live to see the day
Let this be the prayer
Now...
Fever
Can you feel the fever?
Let me hear the sound
Let me draw 'em down
Let me feel the reckless speeding into the unknown
Let me feel the fire
Hearing your heartbeat multiplied
Only the rhythm in between us counts tonight
The heat hits and fades after the fall
Smoke in the air from where we let go it all
These undefined ways set the pace off in a blaze
So good to feel the same way"
0.0415,0.479,210372.0,0.561,3rmdMmjzZUTU1kXrLfnCrM,1.07e-05,0.0,0.171,-7.499,1.0,43.0,2018-05-18,0.0324,Someday / Saturday,Phantogram,Someday,97.01700000000001,4.0,audio_features,spotify:track:3rmdMmjzZUTU1kXrLfnCrM,0.0429,"Someday I'll find you
I'll meet you, complete you
Someday I'll dig out my eyes
It's all a painting, a brand new Mercedes
Crashing and burning alive
Today we swam out where the sun hit the horizon
But I kept your head under a tide
It's all compassion, distractions from my actions
Too late I'll never realize, realize
I'm always gonna miss you
I'm always gonna feel you
In everything that I do, I do
To never be with you, oh I miss you so
If only I could see you
I'd tell you that I love you, I do
Someday I'll be with you
Oh, I love you so"
0.11199999999999999,0.575,144800.0,0.49200000000000005,5uCOnavuGsjM1rQOPMxKRH,2.2800000000000002e-05,10.0,0.094,-7.022,1.0,38.0,2018-05-18,0.0276,Someday / Saturday,Phantogram,Saturday,122.98,4.0,audio_features,spotify:track:5uCOnavuGsjM1rQOPMxKRH,0.20800000000000002,"You are a car
You are a hospital
I'd walk to hell and back
To see you smile
On Saturday
You are a star
You are a sea of air
I play great keyboards
Of horses' teeth
On Saturday
On Saturday
I'd like to tell you
How I feel
I'll probably keep it
Til Saturday
Oh Saturday, Saturday
Oh Saturday, Saturday
Oh Saturday, Saturday
Oh Saturday, Saturday
Oh Saturday, Saturday"
0.8390000000000001,0.292,220050.0,0.433,4BtnAROeVETnXcUHDK2Ahn,3.45e-05,0.0,0.14400000000000002,-8.586,1.0,40.0,2019-03-08,0.0387,Beware of the Dogs,Stella Donnelly,Lunch,80.866,4.0,audio_features,spotify:track:4BtnAROeVETnXcUHDK2Ahn,0.217,"Cracking my neck in the consulate line
While a homesick American flag's hanging by
In the fluorescent light
Up close, I see how they stitched on the stars and stripes
If I were honest, and if you were brave
You’d ask me a question and stay for the answer
I like the way that you tell all your tales
Would it kill you to listen
And I get homesick before I go away
I get homesick before I go away, away
La la
La la la la
La la, la la la
Green origami, needles and grapes
You cry like an army, you drive like P-plates
There is much to be said for
The way that you brake when a red light's in front of you
You ask me to give you my world, ah, the day 
We'll do this together
We got years to waste 
You got lots of persuasions, and time to explain
But I’ve only got time for lunch
And I get homesick before I go away
I get homesick before I go away
Before I go away
Before I go away
Oh, oh 
La la
La la la la
La la, la la la"
0.0841,0.48200000000000004,215327.0,0.441,0IKnrWWYY2cz0mHWKCft6A,0.0,4.0,0.105,-6.877999999999999,1.0,41.0,2019-03-08,0.0354,Beware of the Dogs,Stella Donnelly,Beware of the Dogs,75.28,3.0,audio_features,spotify:track:0IKnrWWYY2cz0mHWKCft6A,0.395,"This street is haunted like a beast
That doesn't know its face is frightening to behold
All the painted little gnomes
Smiling in a line, tryna get your votes
There's an architect setting fire to her house
All the plans were there, but they built it inside out
No one will endure what the sign told them they would
Beware of the dogs, beware of the dogs
My home, carpet on the stairs
Everyone in bed, their eyes are white as clouds
Next door, sounds like bloody war
Waiting for the phone, telling us to run
There's an architect setting fire to her house
All the plans were there, but they built it inside out
No one will endure what the sign told them they would
Beware of the dogs, beware of the dogs
There's no Parliament worthy of this country's side
All these pious fucks taking from the '99
Now we'll all endure what the sign told us we would
Beware of the dogs, beware of the dogs"
0.0383,0.496,201667.0,0.46399999999999997,57mUVlvVkKYelyRMBSXgKx,0.00329,2.0,0.177,-7.032,1.0,3.0,2018-11-16,0.027999999999999997,Cote,COTE,Cruel,105.053,4.0,audio_features,spotify:track:57mUVlvVkKYelyRMBSXgKx,0.159,"Maybe he thinks the ordinary's cruel
Modern methods overthrow the rules
I am still the one to play the fool
Even after everybody said to cover your ears and keep moving
Don't invite another chance to fall through
How lonely I was seduced by the prospect of a change, of a promise like you
Maybe he always tells you he's okay
Modern methods dig an early grave
I may never learn to walk away
Even after everybody said to cover your ears and keep moving
Don't invite another chance to fall through
How lonely I was seduced by the prospect of a change, of a promise
I believed it because that's what I wanted
Now my hands are shaking
And my heart is trying hard to replace it
So I go where I wanted
City streets just to keep me
Just to keep me here"
0.0658,0.616,190482.0,0.649,0P9cVrBufbEl8EKoiDj8Tz,0.5920000000000001,0.0,0.212,-8.07,1.0,3.0,2018-11-16,0.0247,Cote,COTE,Meet Me in the Morning,132.46200000000002,4.0,audio_features,spotify:track:0P9cVrBufbEl8EKoiDj8Tz,0.765,"JOHNNY COPE
Cope sent a sessage from Dunbar
Sayin' Charlie meet me if you dare
And I'll learn you the art of war
If you'll meet me in the morning
Hey, now Johnny are you wailin' yet
And are your drums a beatin' yet
If you're walkin' I would wait
You're going to the coals in the morning
When Charlie looked the letter upon
He drew his sword his scabbard from
Follow me my merry men
And we'll meet Johnny Cope in the morning
Go now Johnny get up and run
The highland 'pipes are making a din
It's better to sleep in a hail skin
It will be a bloody mornin'
When Johnny Cope to Dunbar came
He asked of him, ""Where's all your men?""
They'll confound me again and again
For I left them all in the mornin'
Hey, now Johnny you weren't too late
To come with news of your defeat
And leave your men in such a state
So early in the morning
REEL: ""FERMOY LASSES""
JERUSALEM RAP
I'm a stranger here from Ireland's shore
I've been on the raod six months or more
Hikin', workin', travelin' in style
I'm a vagabond from Ireland's isle
Me sunburned thumb stuck up in the air
Many's the lift from here to there
Cars, buses, vans and trains
In the punishing heat, the snow, and the rain
Chorus:
Oh whack fol the diddle fol the
Di ro day
Whack fol the diddle fol the der-
Oh Mrs. Dolan, yer son he isn't workin'
I came from Dublin to Jerusalem town
Had a drink or twon on the journey down
At a railway station called Gar du Nord
Missed my train thru garglin' hard
Three days later in Napoli on a Turkish boat
I sailed to sea slept in a hot hole down below
Travelin' tourist class ya know
Chorus"
0.534,0.7090000000000001,213633.0,0.46399999999999997,42ri8tCtPeHfGQJTo7zIVX,0.575,7.0,0.0833,-8.481,1.0,44.0,2018-02-15,0.0287,Small Foreign Faction,Haley Blais,Small Foreign Faction,113.98299999999999,4.0,audio_features,spotify:track:42ri8tCtPeHfGQJTo7zIVX,0.556,"I'm just a foreign faction
Irreconcilable conflict at parties
I feel like a chain reaction
But sadly I don't know how it started
I never wanted anything and
I never got it
I never wanted anything and
I never got it
I like to sit around fires
And catch the embers on my tongue
Listening to a church choir
Sing some hymns about someone
I never wanted anything and
I never got it
I never wanted anything and
I never got it
I never wanted anything and
I never got it
I never wanted anything and
I never got it
I'm just a foreign faction
Irreconcilable conflict at parties
I feel like a chain reaction
But sadly I don't know how it started
I never wanted anything and
I never got it
I never wanted anything, yeah
Look I got it
Look I got it"
0.0978,0.71,229017.0,0.44799999999999995,4MGoadolIhue3MZ3bKgqR1,0.111,0.0,0.111,-10.875,1.0,33.0,2018-06-29,0.0313,Rabbit,Moon Panda,Rabbit,106.03,4.0,audio_features,spotify:track:4MGoadolIhue3MZ3bKgqR1,0.387,"I love you like a rabbit loves the fear
Like it needs something to hold onto
I need you like a rabbit needs to speak
But it can't fight the fear long enough to say anything
You've been the savior for so long
I've been so faithful now im stuck
I can't go back to nothing
I am all that I have been
I hate this like a rabbit hates to be here
Ready to be outside these wide eyes
I thought I'd cry
I love you like a rabbit loves the hoplessness
Of a situation
I thought I'd die
You've been the savior for so long
I've been so faithful now im stuck
You've been the savior for so long
I've been so faithful now im stuck
I can't go back to nothing
I am all that I have been
I love you like a rabbit loves the fear
Like it needs something to hold onto"
0.0399,0.7759999999999999,147867.0,0.562,7K0iidDYDudSm9BoSt901M,0.0,9.0,0.138,-6.901,1.0,75.0,2019-05-08,0.363,RICKY,Denzel Curry,RICKY,169.03,4.0,audio_features,spotify:track:7K0iidDYDudSm9BoSt901M,0.521,"First they mockin', now they hoppin'
All on the wave, 'cause they see me poppin'
Big-big-big large pockets, they start flockin'
Here's what I say when they ass keep knockin'
My daddy said, ""Trust no man but your brothers
And never leave your day ones in the gutter""
My daddy said, ""Treat young girls like your mother""
My mama said, ""Trust no ho, use a rubber""
I'ma act, one, two, stop the track
Bring it back, what it do?
See, Ricky said, ""Never let nobody get the one up on you
If they run up on you, hit 'em with a one, two or a bitch slap
Leave the cul-de-sac, your brothers gon' have your back regardless
And stick with your day one homies that was here before you started
And fear no man, but the man above your head""
""Pray before you go to bed,"" every day my mama said
First they mockin', now they hoppin'
All on the wave, 'cause they see me poppin'
Big-big-big large pockets, they start flockin'
Here's what I say when they ass keep knockin'
My daddy said, ""Trust no man but your brothers
And never leave your day ones in the gutter""
My daddy said, ""Treat young girls like your mother""
My mama said, ""Trust no ho, use a rubber""
My daddy said, ""Trust no man but your brothers
And never leave your day ones in the gutter""
My daddy said, ""Treat young girls like your mother""
My mama said, ""Trust no ho, use a rubber""
And your mama ain't shit, your daddy ain't shit
And I been makin' waves way before Nostalgic
That was back in Carol City, yeah, when I was just a jit
With the all-black faded Dickie with the Raider fit
That was it, we was lit, y'all wasn't even shit yet 
We was Three 6, Wu-Tang mixed with Dipset
Ricky used to take me to my first shows ever
Would only drop jewels way before they dropped cheddar
First they mockin', now they hoppin'
All on the wave, 'cause they see me poppin'
Big-big-big large pockets, they start flockin'
Here's what I say when they ass keep knockin'
My daddy said, ""Trust no man but your brothers
And never leave your day ones in the gutter""
My daddy said, ""Treat young girls like your mother""
My mama said, ""Trust no ho, use a rubber""
My daddy said, ""Trust no man but your brothers
And never leave your day ones in the gutter""
My daddy said, ""Treat young girls like your mother""
My mama said, ""Trust no ho, use a rubber"""
0.0259,0.604,267156.0,0.66,37HiXJE6AXeMa9u8g1AH56,0.244,1.0,0.294,-9.589,1.0,40.0,2019-03-29,0.175,Guns,Quelle Chris,Obamacare,78.72399999999999,4.0,audio_features,spotify:track:37HiXJE6AXeMa9u8g1AH56,0.22699999999999998,"I'm tryna burn this bitch down, I ain't tryna break in
Fuck your opinion 'bout us, to me don't mean nathan
I brought the wave, brought the rain, brought the lake in
Eyes on the cake and yours is for the takin', wait man
Puffin' Michael Jordan, catch a lot of air
Shuttin' down your city, then we outta there
Everyone can get it like Obamacare
Keep it buddy, they don't want no problems here
Bucket over earlobes, headache under headdress
Grindin' like I'm soon dyin', 'til I'm laid up bed rest
It's Quelle Chris all day shit, I don't need no playlist
Handsome, black, and headstrong, you nervous 'til your nails gone
Step out daddy long legs, Cab Calloway stride
Make a rapper freeze up like I was Zack in Bayside
I be knuckle down, ape, and 'bout my business, back straight
I was never weirdo, they just had to acclimate
Please, they grip the draws like Coppertone dogs
But ain't got shit to say like back when Poppa Doc lost
More reach than Doctor Ock's arms
Crazy, try to play me, you better call Saul
Train of thought on track, R and R my R&R
Floatin' through the fog, off more drugs than a DeBarge
Don't think it wasn't when it was, he's no mirage
This what's happening, it's Rerun, Dwayne, and Raj
I'm tryna burn this bitch down, I ain't tryna break in
Fuck your opinion 'bout us, to me don't mean nathan
I brought the wave, brought the rain, brought the lake in
Eyes on the cake and yours is for the takin', wait man
Puffin' Michael Jordan, catch a lot of air
Shuttin' down your city, then we outta there
Everyone can get it like Obamacare
Keep it buddy, they don't want no problems here
I'm feelin' like a million stacks, how the fuck you do?
Seein' how you livin', bet you probably feel a buck or two
Ho shit insured, sucker-proof, no deductible
Good neighbors with state pharmaceuticals by the bucketloads
That's Big Green like Ferrigno, if you down like feather pillows
We got wax without the earlobes, if you matchin', hold the euros
No tobacco, just the pure smoke, powdered keif lookin' like churros
If you choke up, you get higher, word to Bridget and Dinero
In a far south beach house, ashy ass, knees out
Barrin' up, beats bounce, eatin' steak and eggs 'til my feet gout
Hippy type freak outs with woke whites who beast hype
Droppin' N-words for my nigga friends only black folks can recite
That's free life, thought he wasn't when he was it
Been it from the beginnin', just gettin' better every minute
Smokin' gun, catchin' the killer and creator
Gave 'em two for one, don't thank me later
I'm tryna burn this bitch down, I ain't tryna break in
Fuck your opinion 'bout us, to me don't mean nathan
I brought the wave, brought the rain, brought the lake in
Eyes on the cake and yours is for the takin', wait man
Puffin' Michael Jordan, catch a lot of air
Shuttin' down your city, then we outta there
Everyone can get it like Obamacare
Keep it buddy, they don't want no problems here
Dumpin' Dutchie guts out the window
Keep it buddy, strictly for the kinfolk
Lightin' up the outdoor in the indoor
This ain't for you, this is for the kinfolk
Dumpin' Dutchie guts out the window
Keep it buddy, strictly for the kinfolk
Lightin' up the outdoor in the indoor
This ain't for you, this is for the kinfolk"
