acousticness,danceability,duration_ms,energy,id,instrumentalness,key,liveness,loudness,mode,popularity,release_date,speechiness,spotify_album,spotify_artist,spotify_song,tempo,time_signature,type,uri,valence,lyrics
0.166,0.607,245333.0,0.713,0ToC28lLiwEKyQdN4FXypS,0.0,5.0,0.769,-6.206,1.0,58.0,2018-07-19,0.243,1998 TRUMAN,BROCKHAMPTON,1998 TRUMAN,134.994,4.0,audio_features,spotify:track:0ToC28lLiwEKyQdN4FXypS,0.48200000000000004,"""You’re not free with your Cadillac! You’re doing just exactly what the Man wants you to do: Buy his goods, so you’ll never have any real economic freedom. He wants you to buy everything he advertises on TV, so he’ll keep you perpetually owing your soul to the company store. You’re not free, you’re a slave—!""
Gimme no drugs, lend me some love
Tonight, while I'm in this club
Lonely as fuck, with my thugs
And we looking for that buzz
Gimme no drugs, lend me some love
Tonight, while I'm in this club
Lonely as fuck, with my thugs
And we looking for that buzz
What's with these superficial people from my past?
Dancin' 'round the fact that
I did everything the motherfuckers bet against
They be like, ""Gather 'round, place your bets!
This young man won't ever be shit!""
Well my bad, I guess I just pursued this shit
While you chose to settle down to have some kids
I mean, it's okay to fall in line, just don't look back
That's a long ass line that I'm not in
I just never found the time, or had the chance
Truth is: you can kiss my ass
Never been the one to bow down
Never been the one to air out any situation, but right now
When it's all your fault, I'm here now
Gimme no drugs, lend me some love
Tonight, while I'm in this club
Lonely as fuck, with my thugs
And we looking for that buzz
Gimme no drugs, lend me some love
Tonight, while I'm in this club
Lonely as fuck, with my thugs
And we looking for that buzz
Don't talk back, don't talk back, boy, don't
Don't talk back, don't talk back, boy, don't
Don't talk back, don't talk back, boy, don't
Don't talk back, don't talk back, boy, don't
Thrift like a five hundred discount
I move it, I move it like Madagascar
Flip it like eight ball to inside of nose, it get raw
Bloody leaf color like fall
When you were calling, they said I'll be nothing
Well, suck on my dick and then lick on my balls
They try to pin me down, they try to bind me
And they try to kill me like Anna Nicole
Th—th—they want to boot up my car
Pussy boy like booty call
Money quick like auctioneer
Look what we did in a year
You need a neutral career
I hate on myself when I look in the mirror
Piddling voices all up in my ear
Why do I care how I look?
Why do I care what they say?
I do not care what they say! 
Nowadays, everybody wanna talk 
They forgot how to listen 
'Til the prophets arisen
We mix New Edition with nuclear fission
I don't do auditions, I don't ask permission
Ain't no politician, don't ask my opinion
You got an addiction to what ain't your business
Make the admission, I make like magicians and hit my Houdini
Why they so soft like linguine? I murder this music routinely
I know that you see me, don't see you searching the meaning
I think that’s why you won't believe and the future is leaning
Revolutions started streaming
The reason why you see me beaming
I'm dreaming of making moves like the government
You better think about who you fucking with, get back!
Don't talk back, don't talk back, boy, don't
Don't talk back, don't talk back, boy, don't
Don't talk back, don't talk back, boy, don't
Don't talk back, don't talk back, boy, don't
 Oh, your love
Won't you come this close to me?
Yeah, yeah, yeah, yeah
Be with me now that you're free 
Oh yeah 
Won't you come this close to me, baby?
Baby, yeah 
And if I could erase who you thought I was
Ah, ah, ah, ah, ah
And if I could erase who you thought I was
Ah, ah, ah, ah, ah"
0.278,0.765,153351.0,0.542,6JyEh4kl9DLwmSAoNDRn5b,1.87e-05,1.0,0.609,-6.755,1.0,70.0,2018-06-08,0.39,KIDS SEE GHOSTS,KIDS SEE GHOSTS,4th Dimension,171.945,4.0,audio_features,spotify:track:6JyEh4kl9DLwmSAoNDRn5b,0.7340000000000001,"Down the chimney, he will come
With his great big smile
And you'll find that even the kiddies
Are swingin' in the latest style
Oh, oh, oh
What is Santa bringing?
Oh, oh, oh
What is Santa bringing?
It feels so good, it should cost
Bought a alligator, I ain't talkin' Lacoste
Made me say, ""Ugh, uh""
Like a mix of Master P and Rick Ross, uh-uh
She seem to make me always feel like a boss, uh-uh
She said I'm in the wrong hole, I said I'm lost, uh-uh
She said I'm goin' too fast, I'm exhausted
Now drop to your knees for the offerin'
This the theme song of something wrong
Might need an intervention for this new dimension
That's too new to mention, or fit in a sentence
If I get locked up, I won't finish the sent—
Oh, oh, oh
What is Santa bringing?
Oh, oh, oh
What is Santa bringing?
Gettin' loose while I'm rollin' through, see me roll out
Watch you surf, hit the coast, and this feelin', I got
Plenty of ventures for the evenin', we go journey, we off
From the light to guide us home, we in the moment, oh-oh
Such a lost boy, caught up in the darkest I had
What's the cost, boy? Losin' everything that I had
She been on me, boy, 'less you got somethin' to tell
Sittin', waitin' for me slippin', yeah, I'll see you in hell
Tell the cougar get up off me, no, my soul ain't for sale
All the evils in the world, they keepin' on me for real
I really hope the Lord heard me, we all live in sin
Kids See Ghosts off the ropes, Ric Flair on your bitch
Now this the theme song, this the theme song
The put the beams on, get your, get your dream on
But you don't hear me though, drama: we let it go
Watch the guitars roll, but let your friends know
Oh, oh, oh
What is Santa bringing?
Oh, oh, oh
What is Santa bringing?
Just do that and then let the music do somethin',  and then do that again, that'd be enough for a record
I mean, you only want two and a half minutes if you can get it, you know, three minutes max—"
0.359,0.409,280842.0,0.6779999999999999,6TodWdTSDfzwgYynTZSvJn,4.76e-06,9.0,0.16699999999999998,-7.731,1.0,75.0,2018-07-20,0.0878,Head In The Clouds,88rising,Midsummer Madness,89.96799999999999,4.0,audio_features,spotify:track:6TodWdTSDfzwgYynTZSvJn,0.168,"Last night, I lost all my patience
You were fucked up, I was wasted
Midsummer madness
I can't take it no more, no more
Fuck the ru-u-u-ules
Ru-u-u-ules
Ru-u-u-u-oh
Fuck the ru-u-u-ules
Ru-u-u-ules
Ru-u-u-u-oh
Make it make sense
Make it make sense, I
Can't hide a heart in a black tint, I
You were off the bullshit and the tablets
Under 21, both savage
All these blurry nights feel the same to me
Heart full of hate, no vacancy
Only one you gonna blame when it's over
Can't look me in my eyes when you sober
Hey, I'm the one you call when you feelin' low
Running up a check just to help you cope
I just want to live in the moment
You just want to fight 'cause you lonely
Tryna see a milly then be really up
Rockstar crash in my Bentley truck
You need all my love
You've got all the love
Last night, I lost all my patience
You were fucked up, I was wasted
Midsummer madness
I can't take it no more, no more
Fuck the ru-u-u-ules
Ru-u-u-ules
Ru-u-u-u-oh
Fuck the ru-u-u-ules
Ru-u-u-ules
Ru-u-u-u-oh
Uh, ayy, ayy, uh
Been a minute since I heard you wanna stay as friends
I learned from my mistakes, you make me want to learn again
I don't really see the problem, it's a risk I wanna take
You say, ""Let's see where it goes,"" but I don't really wanna wait
Ayy, look and listen up
You've been smiling when we fuck
Let's not even think about it, we ain't gotta talk a lot
Make it hotter than the summer, I'll stay with you when it's not
Put the slow jams on, I wanna see you make it pop, ayy
Moving all around the bed like we just toss and turn, ayy
Playin' with the fire, I don't care if I get burned, ayy
I'ma treat you good like you've been waitin' for your turn, ayy
Nothing in the universe feel better than your tongue, ayy
'Bout to go home, I know you finna come with
I'm playing these games like a pimp on the strip
Conversations late night about how we gonna live
I don't got the answer to it, all I'm finna say is
Fuck the ru-u-u-ules
Ru-u-u-ules
Ru-u-u-u-oh
Fuck the ru-u-u-ules 
Ru-u-u-ules 
Ru-u-u-u-oh 
當光灑進了 white Porsche
I never felt so good
Call me DJ Knowknow, oh-oh no
播放列表歌很夠
你點頭我心裡會滿足
博物館給了更多感悟
在天文台半山道漫步
拼LA夜景的版圖
Fuck the rules
距離不是問題, I know
為了這一刻的feel我值得飛了那麼久
She lookin' so pretty, I wanted a kiss
把beautiful memories 存入我的iPhone X
I, I, I hope 24 can become 48
看日落 粉的天 有藍月亮陪
想要擁抱 你在我需要前給
Sunny gone, I don't care, you're my sunshine babe
I don't feel control
I'm better on my own
I'm used to being so gone for way too long
Long, long, long
Rules, rules, rules
Rules, rules, rules"
0.0171,0.64,188615.0,0.653,6V0PPYLaQ5fCAPftwIgpuN,0.000215,5.0,0.11900000000000001,-6.039,1.0,66.0,2019-01-24,0.0281,Moderation,Florence + The Machine,Moderation,129.986,4.0,audio_features,spotify:track:6V0PPYLaQ5fCAPftwIgpuN,0.611,"Want me to love you in moderation
Do I look moderate to you?
Sip it slowly and pay attention
I just have to see it through
You got me looking for validation
Pastures new
Want me to love you in moderation
Well, who do you think you're talking to?
Then bow your head in the house of God
And little girl, who do you think you are?
You think you need it, you think you want love
You wouldn't want it if you knew what it was
Moderation
Moderation
Moderation 
I never made it with moderation
No, I never understood
All the feeling was all or nothing
And I took everything I could
Can't hold it back, I can't take the tension
Oh, I'm trying to be good
Want me to love you in moderation
Well don't you know, I wish I could
Then bow your head in the house of God
And little girl, who do you think you are?
You think you need it, you think you want love
You wouldn't want it if you knew what it was
Moderation
Moderation
Moderation
Girl, you better learn 
How to hold it in 
And girl, you better learn 
I just can't win 
'Cause I don't see the worth 
I don't see the worth
And I'm still tryna figure out if it
Always, always, always has to hurt
You want love
Moderation
Moderation
Moderation
Moderation"
0.925,0.522,292453.0,0.231,34KZBn42h1icn5V2w0YWEN,0.0,6.0,0.11599999999999999,-7.229,1.0,54.0,2019-01-01,0.0374,My Mistake (Piano Version),Gabrielle Aplin,My Mistake - Piano Version,127.42399999999999,4.0,audio_features,spotify:track:34KZBn42h1icn5V2w0YWEN,0.49700000000000005,"""Congratulations"" - Dessa
""River"" - Bishop Briggs
""Caught Up"" - Sarah Close
""Meteorites"" - Lights
""Writer In The Dark"" - Lorde
""Liablity"" - Lorde
""burning bridges"" - Bea Miller
""September"" - Taylor Swift
""First Burn"" - Ari Afsar, Julia Harriman, Lexi Lawson, Rachelle Ann Go and Shoba Narayan
""Our Word"" - Jessie Shelton
""Answer 36"" - Jessie Shelton
""The Truth"" - Jessie Shelton and Jonathan Groff
""Boys"" - Maris
""Consequences"" - Camila Cabello
""I Didn't Just Kiss Her"" - Jen Foster
""Video Games"" - Lana Del Rey
""Heart for Rent"" - Caitlyn Scarlett
""B.I.G."" - Caitlyn Scarlett
""Shangri-La"" - Caitlyn Scarlett
""Medusa"" - Kailee Morgue
""DaNcing in a RoOm"" - EZI
""anxious."" - EZI
""A Terrible Ride"" - Kristen Delohr Helland
""Dying In LA"" - Panic! At The Disco
""Psychopath"" - Charlotte Lawrence, Nina Nesbitt and Sasha Sloan
""Waking Up Slow "" - Garbielle Aplin
""21"" - Jenna Holiday
""Psycho"" -Lauren Aquilina
""Human"" - dodie and Tom Walker
""Lovely"" - Billie Eilish and Khalid
""Alright"" - Cyn
""Sorry For Writing All The Songs About You"" - Clara Mae
""Neon Gravestones"" - Twenty One Pilots
""I'll Still Have Me"" - Cyn
""Blame"" - Andy Leon
""idontwannabeyouanymore"" - Billie Eilish
""If By Change"" - Ruth B.
""Feels Like This"" - Maisie Peters
""thank u, next"" - Ariana Grande
""Aldo"" - Blossom Caldarone
""My Mistake"" - Gabrielle Aplin
""Call Your Girlfriend"" - Clara Mae
""Talia"" - King Princess
""Upper West Side"" - King Princess
""Dress"" - Taylor Swift
""New Year's Day"" - Taylor Swift"
0.00626,0.532,246441.0,0.632,1y4DajjvaZq3GDIKsYdhDr,0.0,7.0,0.0978,-5.419,0.0,41.0,2014-09-03,0.0366,Cathedrals EP,Cathedrals,Harlem,143.983,4.0,audio_features,spotify:track:1y4DajjvaZq3GDIKsYdhDr,0.402,"You come to pass on my self, on my past
Ohhhh, oohhhh 
Baby don’t worry
I’ll never let you down
When I find the evidence
Chalk it up to providence
Baby don’t worry
It’s all inside your head
Tell me what you wanna know
I will give you quite a show
Gonna take you away
Gonna take you away
When I take you down and they take you away
And I spin you around and I make you wait
And I turn you around
Gonna take you away
Gonna take you away
When I take you down and they take you away
And I spin you around and I make you wait
And I turn you around
I go, you stay, we break
Tell me that’s ok
I go, you stay, we break
Tell me that’s ok
Baby don’t worry
The demons in your head
Always had the best intent
Ever try to listen in?
Baby don’t worry 
I see it on your face 
Banging up against the door 
Hey I won’t let you come in through my door
Hey I won’t let you come in through my door
Come in through my door
Come in through my door
Hey I won’t let you come in through my door
Gonna take you away
Gonna take you away
When I take you down and they take you away
And I spin you around and I make you wait
And I turn you around
Gonna take you away
Gonna take you away
When I take you down and they take you away
And I spin you around and I make you wait
And I turn you around
I go, you stay, we break
Tell me that’s ok
I go, you stay, we break
Tell me that’s ok"
0.7120000000000001,0.41,260867.0,0.364,37VJ3D6WLJcKjW8N4Ccodk,1.32e-05,9.0,0.152,-8.517000000000001,1.0,24.0,2006,0.0351,The Life Pursuit,Belle & Sebastian,Act of the Apostle II,150.911,4.0,audio_features,spotify:track:37VJ3D6WLJcKjW8N4Ccodk,0.245,"I'm bored out of my mind
Too sick to even care
I'll take a little walk
Nobody's going to know
I'm in senior year
It gives you a little free time
I'll just use it all at once!
Took the fence and the lane
The bus then the train
Bought an Independent to make me look like I got brains
I made a story up in my head if anybody would ask
I'm going to a seminar!
I'm a genius
A prodigy
A demon at Maths and Science
I'm up for a prize
If you gotta grow up sometime
You've to do it on your own
I don't think I could stand to be stuck
That's the way that things were going
The bible's my tool
There's no mention of school!
My Damascan Road's my transistor radio
I tune in at night when my mum and my dad start to fight
I put on my headphones
And I tune out
I am devout
The girls are singing about my life
But they're not here, they've got the wild life
If you want to find out, find out
You got to look them in the eye
That's why my only choice
Is find the face behind the voice?
She asked the man if the service was open
'Not today, just the choir from the radio'
'Couldn't I sit in? I've come all this way'
'Will you bugger off, I've got work to do.'
The city was losing its appeal
God was asleep
He was back in her village, in the fields
'Oh, if I could make sense of it all!
I wish that I could sing
I'd stay in a melody
I would float along in my everlasting song
What would I do to believe?'"
0.613,0.57,300801.0,0.504,5MBKDKheLzcGoRYGWpFNNg,0.124,4.0,0.111,-7.417000000000001,1.0,42.0,2016-10-28,0.027999999999999997,Away for All Time,Many Voices Speak,Video Child,119.975,4.0,audio_features,spotify:track:5MBKDKheLzcGoRYGWpFNNg,0.28800000000000003,"Tucked away, under a garden
There's summer's goal
 shooting a gun and
With you, 
I lost sight of your grace
Chasing my fate, chasing my fate
And our fictional moon
I left it too soon
And I'm never gonna go back again
Video Child
And oh, I'm never gonna go back again
Video Child
Heard you got mislead by liars
And you did hide your face
But in my mind, you're still a tiger
And I'm still your friend
We put faith in the sand
Seeking your mend, seeking your mend
In the heat of July
Beginning to feel so alive
And oh, you're never gonna get hurt again
Video Child
And oh, you're never gonna get hurt again
Video Child
And oh, you're never gonna get hurt again
Video Child
And oh, you're never gonna get hurt again
Video Child"
0.478,0.53,369307.0,0.652,4ZB6Wrh3QUnjfl9ciZXeGh,0.28,10.0,0.106,-10.655999999999999,0.0,47.0,2018-08-31,0.0339,Tank Town,Many Voices Speak,Bony Shelter,84.023,4.0,audio_features,spotify:track:4ZB6Wrh3QUnjfl9ciZXeGh,0.32299999999999995,"Found a way to stay out of the doubt
Found someone to keep you satisfied
It's a bony shelter
They think you could feel better
Just don’t look into those eyes
'Cause when your cold heart answers
You don't want it to stop
Don’t want it to stop
Until you
Believe their comments
You don't want it to stop
Don't want it to stop
You always liked the kisses taste like wine
In the way, you're hidden side by side
It's a bony shelter
Writing your love letters
They make you feel so strange inside
You're such a long time
I wanted to believe my own lie
Lover don't doubt
I wanna show the world what we've found
’Cause when your cold heart answers
You don’t want it to stop
Don't want it to stop
Unless you
Believe their comments
You don’t want it to stop
Don't want it to stop
Until
When your cold heart answers
You don't want it to stop
Don't want it to stop
Unless you
Believe their comments
You don’t want it to stop
Don't want it to stop"
0.149,0.5429999999999999,205893.0,0.5489999999999999,41oqThgUF4yiNz77TazXtl,0.08199999999999999,0.0,0.114,-6.497000000000001,1.0,55.0,2017-01-09,0.0306,Now & Then,Sjowgren,Now & Then,80.079,4.0,audio_features,spotify:track:41oqThgUF4yiNz77TazXtl,0.40399999999999997,"Two kids growing up together
You didn't know what I was up to
Asked you out in my little round way
Down down shooting me down
You held me tight
So I wouldn't cry but you
You don't remember
You don’t remember
We all remember different sides
I knew then what I know now
I may lose it for a second now and then
I knew then what I know now
I may lose it for a second now and then
We grew from one to another
Learning what we would fall into
Attraction tells when what want most
Found found heard where I’d gone
Some things had changed
But others stayed the same and you
You had your stories
Some different stories I left behind
I knew then what I know now
I may lose it for a second now and then
I knew then what I know now
I may lose it for a second now and then"
0.591,0.444,211120.0,0.376,1jCfkIVUwdHAne3qnj3LLq,0.0476,0.0,0.0884,-13.597999999999999,1.0,21.0,2018-02-09,0.0687,Expectations,Wild Child,Follow Me,92.01899999999999,4.0,audio_features,spotify:track:1jCfkIVUwdHAne3qnj3LLq,0.0798,"Oh you made me wonder
Opened another door
Where I ain't been in a while
I know I shouldn't boy but
Let's have another pour
That moon makes me thirsty for wine
And I said, ""Would you look at that, I think I love your body""
You read mine like a book
Oh the marks that I made upon your shoulders
Sure gave you a good look
Let's have another go
We'll learn something we didn't know
I'll be your distraction a while
These afternoons move slow
Don't have no place to go
And the company we keep is so kind
And I said, ""Would you look at that, I think I love your body""
You read mine like a book
Oh the marks that I made upon your shoulders
Sure gave you a good look
Maybe we'll take our time
And for the moment you'll be mine
I know you play all the right cards
And when the day is done
I'll try and pack up and be gone
We'll see if I make it past the yard
And I said, ""Would you look at that, I think I love your body""
You read mine like a book
Oh the marks that I made upon your shoulders
Sure gave you a good look
And I said, ""Would you look at that, I think I love your body""
You read mine like a book
Oh the marks that I made upon your shoulders
Sure gave you a good look
Sure gave you a good look
Sure gave you a good look"
0.7909999999999999,0.711,174400.0,0.258,22wcNdDej7sJO0UnaerFN7,0.0008789999999999999,10.0,0.10099999999999999,-8.956,0.0,54.0,2017-03-23,0.0693,World On Fire,Louis The Child,World On Fire,75.007,4.0,audio_features,spotify:track:22wcNdDej7sJO0UnaerFN7,0.423,"I keep watching the world trace
Their circles in their places
Joining the race inside a maze
Look 'round, are you one of them?
Yeah, see how they can all seem
Pointless in worry
Slow down to hurry
The world could be on fire
And we wouldn't know
The temperature is rising
And no one knows
Hide behind the money
That's the way it goes
The world could be on fire
And we wouldn't know
Complaining 'bout the same things
Not watching where we're goin'
Ending up 50
Somehow with nothing
No don't listen to what they say
I admit I know that I have
Don't be the same
Don't be the same
The world could be on fire
And we wouldn't know
The temperature is rising
And no one knows
Hide behind the money
That's the way it goes
The world could be on fire
And we wouldn't know
And so it goes another day here
Passing by
I saw it waving from the window
Could you save me?
Keep takin' time, takin' your time
But there's no time left
Listen for it's almost over
Yeah
The world could be on fire
And we wouldn't know
The temperature is risin'
And no one knows
We'll hide behind the money
That's the way it goes
The world could be on fire
And we wouldn't know"
0.8320000000000001,0.506,373867.0,0.466,1kJYmG59kwtbs2rvkqpzB6,0.648,8.0,0.153,-12.183,1.0,46.0,2016-07-29,0.0372,Looking for Knives,DYAN,Looking for Knives,110.132,4.0,audio_features,spotify:track:1kJYmG59kwtbs2rvkqpzB6,0.0859,"I went looking for blood
And they're giving me bone
And I wanted a map
And I got directions back home
I went looking for knives
And they're giving me balloons
I went looking for knives
And I was looking for you
And I wanted a race
And I got a parade
And they gave me a picture of the mess I'd make
I went looking for knives
And they're giving me balloons
I went looking for knives
And I was looking for you
I was working for dollars
But they're giving me dimes
And I wanted a rush
But they're giving me time
I went looking for knives
And they're giving me balloons
I went looking for knives
And I was looking for you
I went looking for body
And they're giving me thin
I was hoping to sail through
But they're making me swim
I went looking for knives
And they're giving me balloons
I went looking for knives
And I was looking for you
I went looking for waking
And they're giving me dream
And I wanted the night
But they're making me sleep
I went looking for knives
And they're giving me balloons
I went looking for knives
And I was looking for you
I went looking for power
But they're giving me heart
And I wanted an ending
But they're giving me start
I went looking for knives
And they're giving me balloons
I went looking for knives
And I was looking for you"
0.736,0.498,280000.0,0.501,3Dce4qBRrIbSB2kbgq5H9r,0.239,10.0,0.111,-12.513,1.0,23.0,2018-07-13,0.0479,Absence,DYAN,Absence,160.058,4.0,audio_features,spotify:track:3Dce4qBRrIbSB2kbgq5H9r,0.34600000000000003,"Your eyes speak more than
More than your lips
More than your mouth
Bare were your summer
Shoulders and arms
And slender neck
She rose up beautiful before me
And bare she walks the morning anew
It is the wound she gave me
Through my heart, drives her rain
Her face under the sky is full of golden sun
I drew her through the midnight sky on iron leaves
There is no name for you
You fed me wine on a tender voyage
Within your silk, I love to forget
I step around you softly
Drown away your little hatreds
Your pain is just a memory
As your summer fruit decays
My fire for you stays
Your body is a legend
I launched into her as the earth began to die
It is within her, my name is now known
The hand draws slowly back to the poor art of my eye
These are not fingers I have
Put off your air of tragedy
The art of light on your body
Falls apart in the moonlight
Your eyes speak more than
More than you lips
More than your mouth
Bare were your summer
Shoulders and arms
And slender neck"
0.154,0.601,213000.0,0.499,5t8y1PHIZdLcNLws8vg4rf,6e-06,8.0,0.265,-6.795,1.0,41.0,2017-07-21,0.0342,Happy Birthday,Blood Cultures,Phospholipid,94.867,4.0,audio_features,spotify:track:5t8y1PHIZdLcNLws8vg4rf,0.402,"You ask yourself, ""What am I to do?""
Your mother says, ""Don't let him be cruel""
You ask yourself, ""What am I to say?""
Don't give me away
Don't lead me astray
The way you play your games
You ask yourself, ""What am I to do?""
Your mother says, ""Don't let him be cruel""
You ask yourself, ""What am I to say?""
Don't give me away
Don't lead me astray
The way you play your games"
